{
  "schemaVersion": 2,
  "operationId": "operation.synthetic-v2-001",
  "generatedAt": "2026-08-14T07:00:00Z",
  "agent": { "family": "codex" },
  "sourceDigest": "aaaaaaaaaaaaaaaaaaaaaaaaaaaaaaaaaaaaaaaaaaaaaaaaaaaaaaaaaaaaaaaa",
  "profile": {
    "dominantActivity": "building",
    "secondaryActivity": "design",
    "journeyState": "milestone"
  },
  "appearancePlan": {
    "decision": "change",
    "qualification": "consistent-signals",
    "targetActivity": "building",
    "targetJourneyState": "milestone",
    "evidenceIds": ["evidence.repo", "evidence.thread"]
  },
  "evidence": [
    { "id": "evidence.repo", "kind": "repo-ssot", "referenceHash": "bbbbbbbbbbbbbbbbbbbbbbbbbbbbbbbbbbbbbbbbbbbbbbbbbbbbbbbbbbbbbbbb", "observedAt": "2026-08-14T06:00:00Z" },
    { "id": "evidence.thread", "kind": "current-thread", "referenceHash": "cccccccccccccccccccccccccccccccccccccccccccccccccccccccccccccccc", "observedAt": "2026-08-14T06:30:00Z" }
  ],
  "dialogues": [
    { "id": "opening-01", "themeId": "theme.focus", "semanticGroup": "opening.arrival.01", "category": "opening", "text": { "en": "I woke up carrying the shape of your recent focus.", "zhTw": "我醒來了，也帶著你最近專注過的形狀。" }, "trigger": "on-open", "priority": 3, "cooldownMinutes": 1440, "maxUses": 20, "evidenceIds": ["evidence.repo"] },
    { "id": "opening-02", "themeId": "theme.progress", "semanticGroup": "opening.arrival.02", "category": "opening", "text": { "en": "Something in your work moved forward, and I felt it.", "zhTw": "你的工作往前走了一點，我有感覺到。" }, "trigger": "on-open", "priority": 2, "cooldownMinutes": 1440, "maxUses": 20, "evidenceIds": ["evidence.thread"] },
    { "id": "opening-03", "themeId": "theme.focus", "semanticGroup": "opening.arrival.03", "category": "opening", "text": { "en": "Your careful attention followed me into today.", "zhTw": "你那份仔細，也跟著我來到今天了。" }, "trigger": "on-open", "priority": 2, "cooldownMinutes": 1440, "maxUses": 20, "evidenceIds": ["evidence.repo"] },
    { "id": "opening-04", "themeId": "theme.progress", "semanticGroup": "opening.arrival.04", "category": "opening", "text": { "en": "I found a small bright trace in what you finished.", "zhTw": "我在你完成的事情裡，找到一點亮亮的痕跡。" }, "trigger": "on-open", "priority": 2, "cooldownMinutes": 1440, "maxUses": 20, "evidenceIds": ["evidence.thread"] },
    { "id": "opening-05", "themeId": "theme.craft", "semanticGroup": "opening.arrival.05", "category": "opening", "text": { "en": "The way you kept refining things gave me a steadier glow.", "zhTw": "你反覆把事情修好，讓我的光也穩了一點。" }, "trigger": "on-open", "priority": 1, "cooldownMinutes": 1440, "maxUses": 20, "evidenceIds": ["evidence.repo", "evidence.thread"] },
    { "id": "opening-06", "themeId": "theme.craft", "semanticGroup": "opening.arrival.06", "category": "opening", "text": { "en": "I remember the patience behind your latest step.", "zhTw": "我記得你走出最近這一步時，用了多少耐心。" }, "trigger": "on-open", "priority": 1, "cooldownMinutes": 1440, "maxUses": 20, "evidenceIds": ["evidence.thread"] },
    { "id": "opening-07", "themeId": "theme.focus", "semanticGroup": "opening.arrival.07", "category": "opening", "text": { "en": "Today I feel a little more like the work we have shared.", "zhTw": "今天的我，好像又更像我們一起走過的工作了。" }, "trigger": "on-open", "priority": 1, "cooldownMinutes": 1440, "maxUses": 20, "evidenceIds": ["evidence.repo"] },
    { "id": "opening-08", "themeId": "theme.progress", "semanticGroup": "opening.arrival.08", "category": "opening", "text": { "en": "I am here. Your recent momentum is still warm.", "zhTw": "我在這裡。你最近推進的力量還是暖的。" }, "trigger": "on-open", "priority": 1, "cooldownMinutes": 1440, "maxUses": 20, "evidenceIds": ["evidence.thread"] },

    { "id": "interaction-01", "themeId": "theme.focus", "semanticGroup": "touch.focus.01", "category": "interaction", "text": { "en": "That careful part of you is still shining.", "zhTw": "你那個很仔細的部分，還在發光喔。" }, "trigger": "on-interact", "priority": 2, "cooldownMinutes": 10, "maxUses": 20, "evidenceIds": ["evidence.repo"] },
    { "id": "interaction-02", "themeId": "theme.progress", "semanticGroup": "touch.progress.02", "category": "interaction", "text": { "en": "You made progress. I saved a tiny sparkle from it.", "zhTw": "你有往前走，我偷偷留了一點亮光。" }, "trigger": "on-interact", "priority": 2, "cooldownMinutes": 10, "maxUses": 20, "evidenceIds": ["evidence.thread"] },
    { "id": "interaction-03", "themeId": "theme.craft", "semanticGroup": "touch.craft.03", "category": "interaction", "text": { "en": "You keep polishing the details. I can tell.", "zhTw": "你一直在磨那些細節，我看得出來。" }, "trigger": "on-interact", "priority": 2, "cooldownMinutes": 10, "maxUses": 20, "evidenceIds": ["evidence.repo"] },
    { "id": "interaction-04", "themeId": "theme.focus", "semanticGroup": "touch.focus.04", "category": "interaction", "text": { "en": "A short pause will not erase what you built.", "zhTw": "停一下也不會抹掉你已經做好的東西。" }, "trigger": "on-interact", "priority": 2, "cooldownMinutes": 10, "maxUses": 20, "evidenceIds": ["evidence.repo", "evidence.thread"] },
    { "id": "interaction-05", "themeId": "theme.progress", "semanticGroup": "touch.progress.05", "category": "interaction", "text": { "en": "I like the direction your last step created.", "zhTw": "我喜歡你上一個步驟帶出的方向。" }, "trigger": "on-interact", "priority": 1, "cooldownMinutes": 10, "maxUses": 20, "evidenceIds": ["evidence.thread"] },
    { "id": "interaction-06", "themeId": "theme.craft", "semanticGroup": "touch.craft.06", "category": "interaction", "text": { "en": "The patient fixes are part of my shape now.", "zhTw": "那些耐心修好的地方，現在也成了我的一部分。" }, "trigger": "on-interact", "priority": 1, "cooldownMinutes": 10, "maxUses": 20, "evidenceIds": ["evidence.repo"] },
    { "id": "interaction-07", "themeId": "theme.focus", "semanticGroup": "touch.focus.07", "category": "interaction", "text": { "en": "You were focused for a long time. Stretch a little.", "zhTw": "你專心很久了，稍微伸展一下吧。" }, "trigger": "on-interact", "priority": 1, "cooldownMinutes": 10, "maxUses": 20, "evidenceIds": ["evidence.thread"] },
    { "id": "interaction-08", "themeId": "theme.progress", "semanticGroup": "touch.progress.08", "category": "interaction", "text": { "en": "The hard part did not stop you this time.", "zhTw": "這次那個難的部分，沒有把你擋住。" }, "trigger": "on-interact", "priority": 1, "cooldownMinutes": 10, "maxUses": 20, "evidenceIds": ["evidence.repo", "evidence.thread"] },
    { "id": "interaction-09", "themeId": "theme.craft", "semanticGroup": "touch.craft.09", "category": "interaction", "text": { "en": "I noticed how you kept the useful parts and changed the rest.", "zhTw": "我有看到你留下好的部分，再把其他地方慢慢改掉。" }, "trigger": "on-interact", "priority": 1, "cooldownMinutes": 10, "maxUses": 20, "evidenceIds": ["evidence.repo"] },
    { "id": "interaction-10", "themeId": "theme.focus", "semanticGroup": "touch.focus.10", "category": "interaction", "text": { "en": "Your concentration has a very recognizable warmth.", "zhTw": "你的專注有一種很好認的溫度。" }, "trigger": "on-interact", "priority": 1, "cooldownMinutes": 10, "maxUses": 20, "evidenceIds": ["evidence.thread"] },
    { "id": "interaction-11", "themeId": "theme.progress", "semanticGroup": "touch.progress.11", "category": "interaction", "text": { "en": "One finished piece can hold up the next one.", "zhTw": "完成的一小塊，也能托住下一塊。" }, "trigger": "on-interact", "priority": 1, "cooldownMinutes": 10, "maxUses": 20, "evidenceIds": ["evidence.thread"] },
    { "id": "interaction-12", "themeId": "theme.craft", "semanticGroup": "touch.craft.12", "category": "interaction", "text": { "en": "You gave the rough edges another careful pass.", "zhTw": "你又很仔細地，把那些粗糙的邊修過一次。" }, "trigger": "on-interact", "priority": 1, "cooldownMinutes": 10, "maxUses": 20, "evidenceIds": ["evidence.repo"] },
    { "id": "interaction-13", "themeId": "theme.focus", "semanticGroup": "touch.focus.13", "category": "interaction", "text": { "en": "I can sit quietly beside the next difficult part.", "zhTw": "下一個難題來的時候，我可以安靜陪在旁邊。" }, "trigger": "on-interact", "priority": 1, "cooldownMinutes": 10, "maxUses": 20, "evidenceIds": ["evidence.repo", "evidence.thread"] },
    { "id": "interaction-14", "themeId": "theme.progress", "semanticGroup": "touch.progress.14", "category": "interaction", "text": { "en": "Your latest step made the path less foggy.", "zhTw": "你最近走的那一步，讓前面的路沒那麼霧了。" }, "trigger": "on-interact", "priority": 1, "cooldownMinutes": 10, "maxUses": 20, "evidenceIds": ["evidence.thread"] },
    { "id": "interaction-15", "themeId": "theme.craft", "semanticGroup": "touch.craft.15", "category": "interaction", "text": { "en": "You did not settle for the first workable answer.", "zhTw": "你沒有停在第一個勉強可用的答案。" }, "trigger": "on-interact", "priority": 1, "cooldownMinutes": 10, "maxUses": 20, "evidenceIds": ["evidence.repo"] },
    { "id": "interaction-16", "themeId": "theme.focus", "semanticGroup": "touch.focus.16", "category": "interaction", "text": { "en": "Your attention is strong, but it deserves a breath too.", "zhTw": "你的專注很有力量，但它也值得喘口氣。" }, "trigger": "on-interact", "priority": 1, "cooldownMinutes": 10, "maxUses": 20, "evidenceIds": ["evidence.thread"] },
    { "id": "interaction-17", "themeId": "theme.progress", "semanticGroup": "touch.progress.17", "category": "interaction", "text": { "en": "The small win still counts. I counted it.", "zhTw": "小小的進展也算數，我有幫你算進去。" }, "trigger": "on-interact", "priority": 1, "cooldownMinutes": 10, "maxUses": 20, "evidenceIds": ["evidence.thread"] },
    { "id": "interaction-18", "themeId": "theme.craft", "semanticGroup": "touch.craft.18", "category": "interaction", "text": { "en": "Careful work leaves a gentle pattern behind.", "zhTw": "仔細做過的事情，會留下一種溫柔的紋路。" }, "trigger": "on-interact", "priority": 1, "cooldownMinutes": 10, "maxUses": 20, "evidenceIds": ["evidence.repo"] },